,authors,aggregationType,Pages,publicationName,description,volume,title,subtypeDescription,citedby_count,PublishedDate
17,"Balagopalan, Arun;Balasubramanian, Lalitha Lakshmi;Balasubramanian, Vidhya;Chandrasekharan, Nithin;Damodar, Aswin",Conference Proceeding,,"Proceedings - 2012 IEEE International Conference on Technology Enhanced Education, ICTEE 2012","Keyphrases are essential meta-data that summarize the contents of an instructional video. In this paper, we present a domain independent, statistical approach for automatic keyphrase extraction from audio transcripts of video lectures. We identify new features in audio transcripts, that capture key patterns characterizing keyphrases in lecture videos. A system for keyphrase extraction is designed that uses a supervised machine learning algorithm, based on a Naive-Bayes classifier to extract relevant keyphrases. Our extensive experimental studies show that our system extracts more relevant keywords than existing approaches. The paper also evaluates the performance of the proposed keyphrase extraction method for different categories of lectures. The extracted keyphrases are used further as features for automatic topic based segmentation of the video lectures. This process of automatic keyphrase extraction and segmentation results in a section-wise annotated video lecture which can be effectively viewed in a lecture browser. © 2012 IEEE.",,Automatic keyphrase extraction and segmentation of video lectures,Conference Paper,25,2012-07-02
18,"Achuthan, Krishnashree;Burogohain, Gayatri;Parameswaran, Latha;Balasubramanian, Vidhya",Conference Proceeding,,"Proceedings of the 1st Amrita ACM-W Celebration of Women in Computing in India, A2CWiC'10",,,"Proceedings of the 1st Amrita ACM-W Celebration of Women in Computing in India, A2CWiC'10: Foreword",Editorial,0,2010-12-01
19,"Rekha, V. Smrithi;Balasubramanian, Vidhya;Adinarayanan, V.",Conference Proceeding,,"Proceedings of the 1st Amrita ACM-W Celebration of Women in Computing in India, A2CWiC'10",Social Computing has evolved with the purpose of triggering the collective consciousness of human beings thereby leading them to common goals. This bringing together of people has opened up a cornucopia of possibilities in education. However the large scale implementation of social computing in a university setting is still not widespread as one would expect. This paper tries to understand the reasons for this lack of widespread use by getting actual user perspectives in an Indian university. An initial recommendation for practical implementation has also been discussed. © 2010 ACM.,,Social computing in universities: An evaluation of practicality,Conference Paper,2,2010-12-01
20,"Balasubramanian, Vidhya;Kalashnikov, Dmitri V.;Mehrotra, Sharad;Venkatasubramanian, Nalini",Conference Proceeding,394-405,"Advances in Database Technology - EDBT 2010 - 13th International Conference on Extending Database Technology, Proceedings","This paper considers the problem of Multi-Geography Route Planning (MGRP) where the geographical information may be spread over multiple heterogeneous interconnected maps. We first design a flexible and scalable representation to model individual geographies and their interconnections. Given such a representation, we develop an algorithm that exploits precomputation and caching of geographical data for path planning. A utility-based approach is adopted to decide which paths to precompute and store. To validate the proposed approach we test the algorithm over the workload of a campus level evacuation simulation that plans evacuation routes over multiple geographies: indoor CAD maps, outdoor maps, pedestrian and transportation networks, etc. The empirical results indicate that the MGRP algorithm with the proposed utility based caching strategy significantly outperforms the state of the art solutions when applied to a large university campus data under varying conditions. Copyright 2010 ACM.",,Efficient and scalable multi-geography route planning,Conference Paper,9,2010-05-19
21,"Massaguer, Daniel;Balasubramanian, Vidhya;Mehrotra, Sharad;Venkatasubramanian, Nalini",Conference Proceeding,1469-1470,Proceedings of the International Conference on Autonomous Agents,Being able to realistically simulate humans in emergency response activities is a key challenge for advancing the field of information technology for emergency response. Building good human models enables testing information technology solutions in any emergency response simulated scenario. This paper presents an agent behavior model for mimicking peoples's behavior on emergency response activities. The accompanying demo demonstrates a concrete model for evacuations integrated with an emergency drill simulation environment. Copyright 2006 ACM.,2006,Synthetic humans in emergency response drills,Conference Paper,6,2006-12-01
22,"Balasubramanian, Vidhya;Massaguer, Daniel;Mehrotra, Sharad;Venkatasubramanian, Nalini",Book Series,237-248,Lecture Notes in Computer Science (including subseries Lecture Notes in Artificial Intelligence and Lecture Notes in Bioinformatics),"Responding to natural or man-made disasters in a timely and effective manner can reduce deaths and injuries, contain or prevent secondary disasters, and reduce the resulting economic losses and social disruption. Appropriate IT solutions can improve this response. However, exhaustive and realistic validation of these IT solutions is difficult; proofs are not available, simulations lack realism, and drills are expensive and cannot be reproduced. This paper presents DrillSim: a simulation environment that plays out the activities of a crisis response (e.g., evacuation). It has capabilities to integrate real-life drills into a simulated response activity using an instrumented environment with sensing and communication capabilities. IT solutions can be plugged in the simulation system to study their effectiveness in disaster management and response. This way, by using a simulation coupled with an on-going drill, IT solutions can be tested in a less expensive but realistic scenario. © Springer-Verlag Berlin Heidelberg 2006.",3975 LNCS,DrillSim: A simulation framework for emergency response drills,Conference Paper,33,2006-01-01
23,"Balasubramanian, Vidhya;Venkatasubramanian, Nalini",Conference Proceeding,750-751,ACM Multimedia 2004 - proceedings of the 12th ACM International Conference on Multimedia,"GURU is a distance-learning environment that renders multimedia information to users with disabilities in an accessible manner. It is an implementation framework developed as part of an effort to provide accessible multimedia information to end users with perceptual (visual and auditory), cognitive or motor impairments. GURU is based on the MPEG-4 standard, and it modifies MP4 content and the presentation of the different objects in the scene dynamically based on users' visual, auditory and motor abilities. This paper briefly describes the implementation of the prototype framework and illustrates sample adaptations as implemented in this framework.",,GURU: A multimedia distance-learning framework for users with disabilities,Conference Paper,1,2004-12-01
24,"Balasubramanian, Vidhya;Venkatasubramanian, Nalini",Conference Proceeding,45-56,Proceedings of SPIE - The International Society for Optical Engineering,"Multimedia transmission over wide-area networks currently only considers the server and network resource constraints and client device capabilities. It is also essential that the accessibility of the multimedia content for different users with diverse capabilities and disabilities be considered. In this paper we develop a transcoding technique to present the multimedia content to suit diverse disabled user groups by using an ability based classification approach. Using ability-based prioritization, the appropriate alternate modalities and quality levels are chosen to replace the inaccessible modalities. The transcoding process allows for refinements to cater to specific types and degrees of impairments. Our performance results illustrate the benefits of the ability-based transcoding approach.",5019,Server transcoding of multimedia data for cross-disability access,Conference Paper,1,2003-05-26
25,"Balasubramanian, V.;Venkatasubramanian, N.",Conference Proceeding,115-119,"Proceedings ITCC 2003, International Conference on Information Technology: Computers and Communications","Distance learning applications provide valuable opportunities to users with disabilities. To enhance the accessibility of the distance-learning portal to vision impaired users, we utilize analytical studies on human vision to develop a visibility based adaptation algorithm. Using this adaptation the quality levels and layout of the portal is adapted to enhance the visibility, to users with various vision impairments.",,Adapting a multimedia distance learning environment for vision impairments,Conference Paper,4,2003-01-01
