,authors,aggregationType,Pages,publicationName,description,volume,title,subtypeDescription,citedby_count,PublishedDate
0,"Dev, Rahul E.;Balasubramanian, Vidhya",Journal,207-231,Journal of Intelligent Information Systems,"Diversified Query Expansion aims to present the user with a diverse list of query expansions so as to better communicate their intent to the retrieval system. Current diversified expansion techniques either make use of external knowledge sources to explicitly model the various aspects and their relationships underlying the user query or implicitly model query aspects. However these techniques assume query aspects to be independent of each other. We propose a unified framework that produces diversified query expansions in a completely implicit manner while also considering the relationships between query aspects. In particular, the framework identifies query aspects and their relationships by making use of the semantic properties of context phrases that occur within the top-ranked retrieved documents for the supplied user query, and maps them onto a Mutating Markov Chain model to generate a diverse ordering of query aspects. We test our framework against a set of ambiguous and faceted queries used in the NTCIR-12 IMine-2 Task and through an extensive empirical analysis, we show that our framework consistently outperforms existing implicit diversified query expansion algorithms. The utility of our algorithm truly comes up in the second set of experiments where we generate diversified query expansions for a retrieval engine indexing documents from specific scientific domains. Even in such a niche scenario our algorithm consistently provides robust results and performs better than other implicit approaches.",55,An implicit aspect modelling framework for diversity focused query expansion,Article,1,2020-10-01
1,"Vignesh Kumar, K.;Sourav, R.;Shunmuga Velayutham, C.;Balasubramanian, Vidhya",Book Series,503-515,Communications in Computer and Information Science,"Recently, games like Pac-Man have been hotbeds for neuroevolution research and NEAT has emerged as one of the leading techniques in the game playing domain[14]. In the context of the snake game, the goal of this paper is to enhance neuroevolution strategies with better fitness functions for effective goal finding. We develop greedy and non-greedy fitness functions, and demonstrate the effectiveness of these functions in both environments with and without dynamic obstacles. We then present an alternate implementation using the NEAT algorithm combined with Novelty Search to increase the genetic diversity of the agent population and explore the problem space without specifying direct objectives. These conclusions suggest that even with a low number of simple inputs, and simple fitness functions, agents are quickly able to achieve a novice amount of expertise in the Snake game using NEAT.",1287,Fitness Function Design for Neuroevolution in Goal-Finding Game Environments,Conference Paper,0,2020-01-01
2,"Edachana, Resmi P.;Kumaresan, Abishek;Balasubramanian, Vidhya;Thiagarajan, Ramachandran;Nair, Bipin G.;Thekkedath Gopalakrishnan, Satheesh Babu",Journal,,Microchimica Acta,"A paper-based colorimetric assay for the determination of bilirubin has been developed. The method is based on the in-situ reduction of chloroauric acid to form gold nanoparticles. A chromatographic paper was patterned using a wax printer. Chloroauric acid was drop-cast onto the reagent zone. In the presence of bilirubin, gold(III) ions are reduced and form gold nanoparticles. This leads to a color change from yellow to purple. The intensity of the purple color (peak at 530 nm) increases with bilirubin concentration in the 5.0 to 1000 mg L−1 range. The detection limit is 1.0 mg L−1. For the quantification of bilirubin, images were captured using a digital camera, and data were processed with the help of machine learning-based supervised prediction using Random Forest classification. The method was applied to the determination of bilirubin in urine samples. The spiked urine samples exhibit more than 95% recovery. [Figure not available: see fulltext.].",187,Paper-based device for the colorimetric assay of bilirubin based on in-situ formation of gold nanoparticles,Article,21,2020-01-01
3,"Sundar, Darshak;Sendil, Siddharth;Subramanian, Vasanth;Balasubramanian, Vidhya",Journal,2621-2632,Journal of Ambient Intelligence and Humanized Computing,"Indoor pervasive applications depend on reliable indoor localization solutions. Indoor localization using WiFi is gaining ubiquitous usage owing to its simplicity and inexpensiveness. A conventional method of localization is trilateration, which can be accomplished using signal strength or time of flight of a radio signal between receiver and transmitter. However, trilateration is prone to errors in accuracy that can occur due to various factors. A common reason for the failure of trilateration is due to the errors in distance estimation resulting in a poor quality of trilateration. In this paper, we propose a novel weighted adaptive location estimation (WALE) algorithm. The proposed WALE algorithm provides an accurate localization in comparison to trilateration by taking into account the quality and properties of the circle overlaps. Based on the overlap properties a distance re-estimation and classification of points based on whether they are trilaterable is performed. A maximum likelihood estimation over a weighted grid of this region provides the location estimate. Our experiments over real indoor test-beds have demonstrated that our algorithm provides high accuracies with high stability in comparison to other algorithms. We achieve high accuracies ranging from 1.20 to 2.20 m in majority of the cases and an average of 2.98 m in a large office space with a standard deviation of 1.65.",10,WALE: a weighted adaptive location estimation algorithm,Article,8,2019-07-01
4,"Mathivannan, S.;Srinath, S.;Shashank, R.;Aravindh, R.;Balasubramanian, Vidhya",Book Series,174-187,Lecture Notes in Computer Science (including subseries Lecture Notes in Artificial Intelligence and Lecture Notes in Bioinformatics),"WiFi based indoor and semi-indoor localization techniques are essential components of indoor location-based services. Calibration-free techniques for WiFi signal strength based indoor localization can help make indoor localization systems scalable, cost-effective and easy to deploy. However, distance estimation errors and environmental factors affect the accuracy of non-calibration solutions like trilateration significantly, and addressing the accuracy issue is critical. To help improve accuracy, localization over dual-band WiFi (IEEE 802.11n) which uses both 2.4Â GHz and 5Â GHz bands is a potential alternative. This paper proposes a novel adaptive, weighted trilateration technique that uses the behavior of these two bands under different conditions. An iterative heuristic approach based on the characterization of the behavior of the bands is employed to determine the most likely position of a smart phone. Additionally optimization strategies are applied to improve the time complexity of this approach. Experiments conducted in different indoor environments show that our approach performs better than other non-calibration signal strength based approaches in terms of accuracy, and also reduces the worst case error.",11474 LNCS,A Dynamic Weighted Trilateration Algorithm for Indoor Localization Using Dual-Band WiFi,Conference Paper,8,2019-01-01
5,"Dharanitejaswini, K.;Balasubramanian, Vidhya",Journal,186-199,International Journal of Wireless Information Networks,"Localization of assets is a critical component of smart building applications. This problem involves a lot of challenges and gets even more challenging when a consistently high level of accuracy has to be ensured while employing long-range RFID readers. In general, these antennas are placed so that there is some level of overlap of their ranges of influence, in order to support asset tracking with high precision. However, it is desirable to reduce the level of overlap when employing multiple readers for large-scale asset tracking, due to the high cost of these RFID readers and antennas. In such scenarios, it is important to maintain accuracy while increasing the coverage area of the readers, and for this a robust localization algorithm is necessary. This paper describes a novel hybrid indoor localization algorithm that combines the transmission power level control and the signal strength information in an intelligent manner to locate assets accurately. The algorithm does not require much calibration and is easily scalable. Additionally, it allows for both coarse and fine-grained location estimation depending on application requirements. Our experiments in real indoor environments, and with different degrees of overlap between long-range RFID antennas show that our algorithm provides higher accuracy in comparison to other algorithms, and is also consistent.",25,A Scalable and Hybrid Location Estimation Algorithm for Long-Range RFID Systems,Article,2,2018-06-01
6,"Balasubramanian, V.",Book,93-105,"Geospatial Infrastructure, Applications and Technologies: India Case Studies","This paper discusses the design and implementation details of a novel toolkit for indoor spaces (InGIST) that supports configuring indoor spaces and querying over them. InGIST implements a hybrid indoor model that effectively combines spatial, geometric and topological models, over which a query language developed as part of this project, operates to support different types of indoor queries. InGIST also supports the IndoorGML standards and allows for exporting to IndoorGML from various formats and querying over IndoorGML. The overall framework and the model are discussed and using use cases and screenshots the different functionalities and salient features of InGIST are highlighted.",,InGIST: A queryable and configurable indoorGIS toolkit,Book Chapter,1,2018-01-01
7,"Muralikumar, Jeyavaishnavi;Seelan, Sri Ananda;Vijayakumar, Narendranath;Balasubramanian, Vidhya",Journal,477-498,Journal of Intelligent Information Systems,"E-Learning repositories and digital libraries are fast becoming important sources for gathering information and learning material. Such systems must therefore provide services to support the learning needs of their users. When a retrieval system shows how its documents relate to each other semantically, a user gets the liberty to choose from different material, and direct his/her study in a focused manner. This calls for a model that identifies types of document relationships, that need to address different aspects of learning. This article defines three such types and a unique statistical model that can automatically identify them in technical/scientific documents. The model defines measures to quantify the degree of relatedness based on distinct statistical patterns exhibited by the common terms in a pair of documents. This approach does not strictly require a knowledge base or hypertext for identifying the characteristic relationship between two documents. Such a statistical model can be extended to build further relatedness types and can be used alongside various other techniques in digital library recommendation engines. Our experiments over a large number of technical documents show that our techniques effectively extract the different types of relationships between documents.",48,A statistical approach for modeling inter-document semantic relationships in digital libraries,Article,5,2017-06-01
8,"Balasubramanian, Vidhya;Doraisamy, Sooryanarayan Gobu;Kanakarajan, Navaneeth Kumar",Journal,121-145,Journal of Intelligent Information Systems,"The rapidly increasing availability of e-learning content and lecture videos over the internet, has brought forth an imperative need for developing effective content based retrieval systems. Comprehensive metadata extraction and support for topic-level search within videos are key factors in developing such systems. In this paper, we propose a multimodal metadata extraction system which extracts an optimal set of keyphrases and topic based segments that effectively summarize the content of a lecture video. The extraction process utilizes features from both audio transcripts and slide content in video streams. A hybrid approach combining a Naive Bayes classifier and a rule-based refiner is used for effective retrieval of the metadata in a lecture. The proposed content-descriptive metadata extraction technique has been evaluated using actual lecture videos from different sources, and our results show that our multimodal approach is effective in summarizing the lecture’s content, potentially improving the user experience during retrieval and browsing.",46,A multimodal approach for extracting content descriptive metadata from lecture videos,Article,18,2016-02-01
9,"Murthy, Suriya D.;Srivenkata Krishnan, S.;Sundarrajan, G.;Kiran Kassyap, S.;Bhagwanth, Ragul;Balasubramanian, Vidhya",Conference Proceeding,436-445,"ICINCO 2016 - 13th International Conference on Informatics in Control, Automation and Robotics, Doctoral Consortium","Indoor localization is a vital part of autonomous robots. Obtaining accurate indoor localization is difficult in challenging indoor environments where external infrastructures are unreliable and maps keep changing. In such cases the robot should be able to localize using their on board sensors. IMU sensors are most suitable due to their cost effectiveness. We propose a novel approach that aims to improve the accuracy of IMU based robotic localization by analyzing the performance of gyroscope and encoders under different scenarios, and integrating them by exploiting their advantages. In addition the angle computed by robots to avoid obstacles as they navigate, is used as an additional source of orientation estimate and appropriately integrated using a complementary filter. Our experiments that evaluated the robot over different trajectories demonstrated that our approach improves the accuracy of localization over applicable existing techniques.",2016-January,A robust approach for improving the accuracy of IMU based indoor mobile robot localization,Conference Paper,6,2016-01-01
10,"Xavier, Sofia Francis;Selvaraj, Lakshmi Priyanka;Balasubramanian, Vidhya",Conference Proceeding,1298-1307,"2015 International Conference on Advances in Computing, Communications and Informatics, ICACCI 2015","With the emergence of the semantic web, effective knowledge representation has gained importance. Statistically generated semantic networks are simple representations whose semantic power is yet to be completely explored. Though, these semantic networks are created with simple statistical measures without much overhead, they have the potential to express the semantic relationship between concepts. In this paper, we explore the capability of such networks and enhance them with concept hierarchies to serve as better knowledge representations. The concept hierarchies are built based on the level of importance of concepts. The level of importance/coverage of a concept within the given set of documents has to be taken into account to build an effective knowledge representation. In this paper, we provide a domain-independent, graph based approach for identifying the level of importance of each concept from the statistically generated semantic network which represents the entire document set. Insights about the depth of every concept is obtained by analysing the graph theoretical properties of the statistically generated semantic network. A generic concept hierarchy is created using a greedy strategy, and the original semantic network is reinforced with this concept hierarchy. Experiments over different data sets demonstrate that our approach works effectively in classifying concepts and generating taxonomies based on it, thereby effectively enhancing the semantic network.",,Enhancing statistical semantic networks with concept hierarchies,Conference Paper,2,2015-09-24
11,"Sivaramakrishnan, Aravind;Krishnamachari, Madhusudhan;Balasubramanian, Vidhya",Conference Proceeding,,ACM International Conference Proceeding Series,"Recommender systems have become very prominent over the past decade. Methods such as collaborative filtering and knowledge based recommender systems have been developed extensively for non-customizable products. However, as manufacturers today are moving towards customizable products to satisfy customers, the need of the hour is customizable product recommender systems. Such systems must be able to capture customer preferences and provide recommendations that are both diverse and novel. This paper proposes an approach to building a recommender system that can be adapted to customizable products such as desktop computers and home theater systems. The Customizable Product Recommendation problem is modeled as a special case of the Multiple Choice Knapsack Problem, and an algorithm is proposed to generate desirable product recommendations in real-Time. The performance of the proposed system is then evaluated.",13-15-July-2015,Recommending customizable products: A multiple choice knapsack solution,Conference Paper,2,2015-07-13
12,"Chandrasekaran, Vishal;Narayan, Keshav;Vasani, Romil Kumar;Balasubramanian, Vidhya",Conference Proceeding,,"2015 IEEE 10th International Conference on Intelligent Sensors, Sensor Networks and Information Processing, ISSNIP 2015","Radio Frequency Identification (RFID) is widely used in indoor positioning systems for object tracking and localization. However, there are several challenges that are yet to be addressed especially in 3-D space. When objects are cluttered densely, an arrangement synonymous to that of heaps of haphazardly arranged files in an office, locating and retrieving a file manually from the heap becomes a laborious task. In this paper, we address the challenge of localization and retrieval of objects in cluttered environments using passive RFID tags, by developing a novel indoor path loss translational model that considers the signal properties across the clutter. The proposed InPLaCE RFID system estimates the position of the object within a clutter by employing a robust translation model that accounts for the properties of the clutter and helps compensate for estimation errors over existing path loss models. Our experiments over different cluttered environments show that the proposed translational model improves the localization accuracy of objects over existing path loss models.",,InPLaCE RFID: Indoor path loss translation for object localization in cluttered environments,Conference Paper,15,2015-05-13
13,"Malla, Hemanth;Purushothaman, Preethish;Rajan, Shivnesh V.;Balasubramanian, Vidhya",Conference Proceeding,203-212,"2014 Ubiquitous Positioning Indoor Navigation and Location Based Service, UPINLBS 2014 - Conference Proceedings","Many of the indoor applications like navigation, indoor localization, object tracking require an indoor map. Indoor environments are dynamic in nature because of the objects present in it. To capture the essence of the indoor environment, it is essential to perform an object level mapping of an indoor space. This is because an object has the potential to alter the map of an indoor environment. Mapping a huge indoor environment could prove to be costly in terms of time with high infrastructure dependency. This compels us to find a simple solution in terms of cost, time and reliability to build an indoor map. The proposed solution should have minimal infrastructure dependence, so that it can be used in situations like disaster and rapid response scenarios, where the available infrastructure is minimal and time is of essence. We propose a Radio Frequency Identification(RFID) based approach which performs an object level mapping of the indoor environment using a portable RFID reader, RFID Ultra High Frequency(UHF) passive tags and inertial navigation sensors(INS). This approach identifies each object in the indoor environment using one or more passive tags. A novel algorithm has been developed which accurately maps the objects present in the indoor space. It is easily scalable to map huge indoor environments and can be applied without any intensive manual labor or expensive equipments. Our experiments show that this approach generates object level indoor maps with high accuracy.",,Object level mapping of an indoor environment using RFID,Conference Paper,9,2015-02-05
14,"Raghavachari, Chakravartula;Aparna, V.;Chithira, S.;Balasubramanian, Vidhya",Conference Proceeding,461-469,Procedia Computer Science,"People counting has a wide range of applications in the context of pervasive systems. These applications range from efficient allocation of resources in smart buildings to handling emergency situations. There exist several vision based algorithms for people counting. Each algorithm performs differently in terms of efficiency, flexibility and accuracy for different indoor scenarios. Hence, evaluating these algorithms with respect to different application scenarios, environment conditions and camera orientations will provide a better choice for actual deployment. For this purpose, in our paper the most commonly implemented Frame Differencing, Circular Hough Transform and Histogram of Oriented Gradient based methods are evaluated with respect to different factors like camera orientation, lighting, occlusion etc. The performance of these algorithms under different scenarios demonstrates the need for more accurate and faster people counting algorithms.",58,A Comparative Study of Vision Based Human Detection Techniques in People Counting Applications,Conference Paper,41,2015-01-01
15,"Shanmugaapriyan, P.;Chitra, H.;Aiswarya, E.;Balasubramanian, Vidhya;Kumar, S. Ashok",Book Series,203-216,Lecture Notes in Computer Science (including subseries Lecture Notes in Artificial Intelligence and Lecture Notes in Bioinformatics),"Wi-Fi based Indoor Localization is commonly used in pervasive systems due to its ease of use and relatively low cost. In recent times, IEEE 802.11n is gaining more attention due to the operation of devices in dual band (2.4GHz and 5 GHz) simultaneously. However the utility of dual band in Wi-Fi indoor localization is still a subject of study and has not been widely implemented. The focus of this paper is to evaluate the feasibility of using both these bands by comparing their indoor localization performance using fingerprinting techniques in a real indoor environment. The effects of interference and localization accuracy are the subject of the experimental study. Based on the study, we propose intelligent policies which effectively utilize the advantages of both the bands. Our experiments and analysis have demonstrated the effectiveness of our policies in improving the accuracy of indoor localization.",8629,A pragmatic approach for effective indoor localization using IEEE 802.11n,Conference Paper,3,2015-01-01
16,"Krishnan, Prasanth;Krishnakumar, Sowmyanarayanan;Seshadri, Raghav;Balasubramanian, Vidhya",Book Series,360-373,Lecture Notes in Computer Science (including subseries Lecture Notes in Artificial Intelligence and Lecture Notes in Bioinformatics),"WiFi Fingerprinting techniques are widely used for indoor localization needs, due to better accuracy guarantees. However, the accuracy is limited by the freshness of the radio map, which is used for localization. Over time this radio map might be incompatible due to the changes in signal strength, a consequence of the dynamic nature of the environment. Therefore, repeated radio map calibration becomes a necessity. Currently radio maps are either manually calibrated, use additional infrastructure or complex algorithms to account for the radio map errors. There is therefore a need for a methodology to update the radio map with minimal additional overhead. This paper proposes a crowdsourcing approach which uses data collected from users of the localization system to maintain the freshness of the radio map. This approach leverages inertial sensors present in commonly used handheld devices, like mobile phones and tablets using which, a trajectory of the path of each user is computed. This trajectory is then coupled with the knowledge of the physical map under consideration to get the real time Received Signal Strength Indicator (RSSI) values at the reference points (RPs). A novel cluster based RSSI propagation policy is proposed where the real time RSSI values obtained are propagated within the clusters. Extensive experiments of our localization system implemented in a real indoor environment shows that this approach maintains radio map freshness while keeping the cost of update low and without need for extra infrastructure. © 2014 Springer International Publishing Switzerland.",8487 LNCS,A robust approach for maintenance and refactoring of indoor radio maps,Conference Paper,6,2014-01-01
